id,date,full_text,score,upvote_ratio,num_comments,total_awards_received,author,subreddit,tickers,cleaned_text
1lhein4,2025-06-22,"Iran war, Back to nuclear: Supply Chain and Stocks of The Inglorious Basterds: Uranium, Plutonium and Thorium

The uranium supply chain is a multi-step global process, beginning with mining and ending with nuclear energy production or waste disposal. Uranium is mainly mined in Kazakhstan, Canada, and Australia. After extraction, it’s processed into yellowcake (U3O8), converted to uranium hexafluoride gas (UF6), enriched to boost U-235 levels, and fabricated into fuel rods for nuclear reactors. Spent fuel becomes radioactive waste, which is stored, reprocessed, or permanently disposed of.

Kazakhstan supplies over 43% of the world’s uranium. Other key producers include Canada, Namibia, and Australia. However, many rely on countries like the U.S., France, and Russia for enrichment and fuel fabrication. The uranium trade is tightly regulated due to its potential use in nuclear weapons.

North American investment is centered on the Toronto Stock Exchange (TSX) and the New York Stock Exchange (NYSE). The TSX specializes in uranium exploration, particularly in Canada’s Athabasca Basin, home to the highest-grade uranium globally. Major TSX-listed companies include Cameco, NexGen Energy, Denison Mines, Fission Uranium, and Global Atomic.

On the NYSE, uranium firms focus on production, enrichment, and fuel supply. Cameco is dual-listed, while Energy Fuels runs the only conventional U.S. uranium mill. Uranium Energy Corp (UEC) leads in in-situ recovery and physical uranium holdings. Centrus Energy offers enrichment services. Companies like Denison and NexGen connect Canadian exploration with U.S. capital.

As Western nations seek to reduce reliance on Russian nuclear materials, these firms gain strategic value. Explorers like Fission and Global Atomic are also drawing investor interest amid tightening global supply and rising demand from China and Europe.

Recent geopolitical tensions have further shaken the uranium market. On June 21, President Donald Trump announced that U.S. forces carried out major strikes on Iran’s nuclear facilities at Fordow, Natanz, and Isfahan, core sites in Iran’s uranium enrichment program. B-2 bombers and over 30 Tomahawk missiles, launched with Israeli coordination, dealt a heavy blow to Iran’s nuclear capabilities.

“These were massive precision strikes,” Trump said, calling the attack a joint effort with Israel and warning of further action if peace doesn’t follow. While Iran isn’t a top uranium supplier, the strike highlights the vulnerability of enrichment infrastructure and raises the stakes in the region. The attack could delay Iran’s nuclear ambitions and prompt renewed interest in supply security and Western uranium projects.

Plutonium, unlike uranium and thorium, isn’t mined. It’s produced in reactors from used uranium fuel and can be reprocessed into MOX fuel. France, Russia, and Japan engage in this practice, though many countries avoid it due to weapons risk. Most plutonium work is government-run. A rare public stock with indirect exposure is BWX Technologies (NYSE), linked to U.S. naval programs.

Thorium is more abundant than uranium and mined with rare earths. It can’t be used directly in reactors and must be converted to uranium-233, a process still in development. India, China, and Norway are leading thorium research due to its safety and low-waste potential. No commercial thorium reactors exist yet. Companies like Ucore Rare Metals (TSX) and Energy Fuels (NYSE) offer limited exposure through rare earth processing.

In summary, uranium remains the core fuel for nuclear power, with significant investment opportunities on the TSX and NYSE. Plutonium is limited to state-led use, while thorium holds long-term potential but is not yet viable commercially. The U.S. strike on Iran’s nuclear sites underscores the geopolitical risks tied to uranium infrastructure and strengthens the investment case for secure, Western-aligned uranium supply chains.

Meanwhile, Kazakhstan and China have expanded energy ties, signing $25 billion in deals, including uranium development. China, with 27 reactors under construction and 150 planned by 2035, is set to become the world’s nuclear demand center. Kazakhstan, though not a nuclear power user, is a key supplier and partner. Trade between the two reached $44 billion in 2024, with Belt and Road investments turning Kazakhstan into a vital Central Asian energy hub.
",16,0.75,0,0,azavio,stockmarket,"['META', 'C']",iran war back nuclear supply chain stocks inglorious basterds uranium plutonium thorium uranium supply chain multistep global process beginning mining ending nuclear energy production waste disposal uranium mainly mined kazakhstan canada australia extraction processed yellowcake u3o8 converted uranium hexafluoride gas uf6 enriched boost u235 levels fabricated fuel rods nuclear reactors spent fuel becomes radioactive waste stored reprocessed permanently disposed kazakhstan supplies 43 worlds uranium key producers include canada namibia australia however many rely countries like us france russia enrichment fuel fabrication uranium trade tightly regulated due potential use nuclear weapons north american investment centered toronto stock exchange tsx new york stock exchange nyse tsx specializes uranium exploration particularly canadas athabasca basin home highestgrade uranium globally major tsxlisted companies include cameco nexgen energy denison mines fission uranium global atomic nyse uranium firms focus production enrichment fuel supply cameco duallisted energy fuels runs conventional us uranium mill uranium energy corp uec leads insitu recovery physical uranium holdings centrus energy offers enrichment services companies like denison nexgen connect canadian exploration us capital western nations seek reduce reliance russian nuclear materials firms gain strategic value explorers like fission global atomic also drawing investor interest amid tightening global supply rising demand china europe recent geopolitical tensions shaken uranium market june 21 president donald trump announced us forces carried major strikes irans nuclear facilities fordow natanz isfahan core sites irans uranium enrichment program b2 bombers 30 tomahawk missiles launched israeli coordination dealt heavy blow irans nuclear capabilities massive precision strikes trump said calling attack joint effort israel warning action peace doesnt follow iran isnt top uranium supplier strike highlights vulnerability enrichment infrastructure raises stakes region attack could delay irans nuclear ambitions prompt renewed interest supply security western uranium projects plutonium unlike uranium thorium isnt mined produced reactors used uranium fuel reprocessed mox fuel france russia japan engage practice though many countries avoid due weapons risk plutonium work governmentrun rare public stock indirect exposure bwx technologies nyse linked us naval programs thorium abundant uranium mined rare earths cant used directly reactors must converted uranium233 process still development india china norway leading thorium research due safety lowwaste potential commercial thorium reactors exist yet companies like ucore rare metals tsx energy fuels nyse offer limited exposure rare earth processing summary uranium remains core fuel nuclear power significant investment opportunities tsx nyse plutonium limited stateled use thorium holds longterm potential yet viable commercially us strike irans nuclear sites underscores geopolitical risks tied uranium infrastructure strengthens investment case secure westernaligned uranium supply chains meanwhile kazakhstan china expanded energy ties signing 25 billion deals including uranium development china 27 reactors construction 150 planned 2035 set become worlds nuclear demand center kazakhstan though nuclear power user key supplier partner trade two reached 44 billion 2024 belt road investments turning kazakhstan vital central asian energy hub
1lhdz1a,2025-06-22,"Investors brace for oil price spike, rush to havens after US bombs Iran nuclear sites


“Before the U.S. attack on Saturday, analysts at Oxford Economics modeled three scenarios, including a de-escalation of the conflict, a complete shutdown in Iranian oil production and a closure of the Strait of Hormuz, ""each with increasingly large impacts on global oil prices.""

“In the most severe case, global oil prices jump to around $130 per barrel, driving U.S. inflation near 6% by the end of this year, Oxford said in the note.”

""Although the price shock inevitably dampens consumer spending because of the hit to real incomes, the scale of the rise in inflation and concerns about the potential for second-round inflation effects likely ruin any chance of rate cuts in the U.S. this year,"" Oxford said in the note, which was published before the U.S. strikes.”

“In comments after the announcement on Saturday, Jamie Cox, managing partner at Harris Financial Group, agreed oil prices would likely spike on the initial news. But Cox said he expected prices to likely level in a few days as the attacks could lead Iran to seek a peace deal with Israel and the United States.
""With this demonstration of force and total annihilation of its nuclear capabilities, they’ve lost all of their leverage and will likely hit the escape button to a peace deal,"" Cox said.
Economists warn that a dramatic rise in oil prices could damage a global economy already strained by Trump's tariffs.”

“Still, any pullback in equities might be fleeting, history suggests. During past prominent instances of Middle East tensions coming to a boil, including the 2003 Iraq invasion and the 2019 attacks on Saudi oil facilities, stocks initially languished but soon recovered to trade higher in the months ahead.
On average, the S&P 500 slipped 0.3% in the three weeks following the start of conflict, but was 2.3% higher on average two months following the conflict, according to data from Wedbush Securities and CapIQ Pro.”


“Bar chart showing The S&P 500 has tended to languish in the immediate weeks following major past episodes of Middle East conflicts, but has recovered in subsequent months.”

https://www.reuters.com/graphics/USA-STOCKS/lbvgzrymkpq/chart.png Me too. It’s times like these that history is your friend and panic is your enemy. I am a vocal Trump critic and strongly disagree with his decision to join this war,  and so much else, but as a trader I do my best to filter that out and concentrate on the chart in front of me. I actually found this context very helpful. Iran always knows USA military potential..
So when it was negotiating with US for sure they took in consideration they could have been attacked...
So, they should,  for sure have discussed it with their mayor partners,  Russia and China , and have a consequential plan...
I think Trump made a huuuuge mistake You're welcome ? I think? Nice!! 👍and completely unnecessary Are you from the future? The king is always right 😂 Do we actually know if there was a real good faith deal or was this like the rest of Trump’s deals? You're",148,0.97,15,0,ChiGuy6124,stockmarket,['C'],investors brace oil price spike rush havens us bombs iran nuclear sites us attack saturday analysts oxford economics modeled three scenarios including deescalation conflict complete shutdown iranian oil production closure strait hormuz increasingly large impacts global oil prices severe case global oil prices jump around 130 per barrel driving us inflation near 6 end year oxford said note although price shock inevitably dampens consumer spending hit real incomes scale rise inflation concerns potential secondround inflation effects likely ruin chance rate cuts us year oxford said note published us strikes comments announcement saturday jamie cox managing partner harris financial group agreed oil prices would likely spike initial news cox said expected prices likely level days attacks could lead iran seek peace deal israel united states demonstration force total annihilation nuclear capabilities theyve lost leverage likely hit escape button peace deal cox said economists warn dramatic rise oil prices could damage global economy already strained trumps tariffs still pullback equities might fleeting history suggests past prominent instances middle east tensions coming boil including 2003 iraq invasion 2019 attacks saudi oil facilities stocks initially languished soon recovered trade higher months ahead average sp 500 slipped 03 three weeks following start conflict 23 higher average two months following conflict according data wedbush securities capiq pro bar chart showing sp 500 tended languish immediate weeks following major past episodes middle east conflicts recovered subsequent months times like history friend panic enemy vocal trump critic strongly disagree decision join war much else trader best filter concentrate chart front actually found context helpful iran always knows usa military potential negotiating us sure took consideration could attacked sure discussed mayor partners russia china consequential plan think trump made huuuuge mistake youre welcome think nice completely unnecessary future king always right actually know real good faith deal like rest trumps deals youre
1lh5d6b,2025-06-21,"Week Recap: Iran and Israel is continuing. Fed held the interest rate steady. 2025 interest rate expectations are continuing negative. The S&P 500 extended losing streak to 2-week. June 16, 2025 – June 20, 2025
First of all, I don't want to be misunderstood. This heat map is weekly that it reflects closing prices from June. 13 to June 20. 

It was a quiet and flat week. The S&P 500 lost 0.15%. However, Nasdaq gained 0.21% and Dow gained 0.02%.

Here are the S&P 500's week-by-week results,

May. 30 close at 5,911.69 - June 6 close at 6,000.36 🟢 (+1.49%)

June 6 close at 6,000.36 - June 13 close at 5,976.97 🔴 (-0.38%)

June 13 close at 5,976.97 - June 20 close at 5,967.84 🔴 (-0.15%)

🔸 Monday: The most important event was FOMC meeting in this week. On the other hand, Trump called for peace deal between Iran and Israel. The stock market opened higher more than 0.5%. During the session, we heard positive news about war. Iran wanted a ceasefire and resume to nuclear talks. The stock market closed higher around 1%. 🟢

🔸 Tuesday: Before the session, retail sales and import/export price index data were released. These industrial datas came below expectations and it's a sign of economic weakness. Trump cut G7 trip due to Middle Easy situtation. He also said EU is not offering fair trade. As we know, when we heard negative news about tariffs, the stock market goes to negatively. The stock market opened lower. During the session, Trum said ""Everyone should immediately evacuate Tehran"" and called ""unconditional surrender"" for Iran's. The stock market closed lower. 🔴

🔸 Wednesday: Sure, Iran's Khamenei rejected Trump's surrender call. The stock market opened slightly higher before the FOMC meeting. Silver hit the highest level since 2012 at $37. I'm following gold and silver, so I have not been writting about other precious metals like palladium. As expected, Fed held interest rate steady. Jerome Powell talked about many topics. He still wants to wait of result of tariffs. Also, the expected rate cut count dropped 2 to 1 in 2025. The S&P 500 closed down just 0.04%. 🔴

🔸 Thursday: Holiday.

🔸 Friday: Interestingly, Fed's Waller said central bank could cut rates as early as July. Sure, the stock market liked this and opened higher around 0.5%. However, during the session, Fed's Barkin said nothing urgent in data warranting a rate cut at this point. Also, Friday was Triple Witching Day which can create high volatility. As a result, the stock market lost its gains and closed lower. 🔴

Despite the FOMC meeting, it was a fairly quiet week. CME FedWatch Tool (you can find via Google search) currently shows no rate cut expected in 2025. As Trump mentioning, is Powell late? What do you think? How was your week?

❓ Note: Many people have asked where screenshots come from in my previous posts. I'm using Stock+ on iPhone and iPad. You can find it on the App Store. If you're using Android, I'm now sure if it's available, but you can try searching ""Stock Map"" or ""Heat Map"". 
Yeah. All of Trumps crazy bullshit instability had to burst the bubble eventually. nvda Grab? US just striked iran",43,0.94,4,0,vjectsport,stockmarket,"['META', 'C']",week recap iran israel continuing fed held interest rate steady 2025 interest rate expectations continuing negative sp 500 extended losing streak 2week june 16 2025 june 20 2025 first dont want misunderstood heat map weekly reflects closing prices june 13 june 20 quiet flat week sp 500 lost 015 however nasdaq gained 021 dow gained 002 sp 500s weekbyweek results may 30 close 591169 june 6 close 600036 149 june 6 close 600036 june 13 close 597697 038 june 13 close 597697 june 20 close 596784 015 monday important event fomc meeting week hand trump called peace deal iran israel stock market opened higher 05 session heard positive news war iran wanted ceasefire resume nuclear talks stock market closed higher around 1 tuesday session retail sales importexport price index data released industrial datas came expectations sign economic weakness trump cut g7 trip due middle easy situtation also said eu offering fair trade know heard negative news tariffs stock market goes negatively stock market opened lower session trum said everyone immediately evacuate tehran called unconditional surrender irans stock market closed lower wednesday sure irans khamenei rejected trumps surrender call stock market opened slightly higher fomc meeting silver hit highest level since 2012 37 im following gold silver writting precious metals like palladium expected fed held interest rate steady jerome powell talked many topics still wants wait result tariffs also expected rate cut count dropped 2 1 2025 sp 500 closed 004 thursday holiday friday interestingly feds waller said central bank could cut rates early july sure stock market liked opened higher around 05 however session feds barkin said nothing urgent data warranting rate cut point also friday triple witching day create high volatility result stock market lost gains closed lower despite fomc meeting fairly quiet week cme fedwatch tool find via google search currently shows rate cut expected 2025 trump mentioning powell late think week note many people asked screenshots come previous posts im using stock iphone ipad find app store youre using android im sure available try searching stock map heat map yeah trumps crazy bullshit instability burst bubble eventually nvda grab us striked iran
1lgx8ar,2025-06-21,"S&P 500: Market Cap-Weighted Returns by Sector (Week Ending 20 Jun 2025)
**What are Market Cap-Weighted Returns?**

Returns here represent the market cap-weighted average for each GICS sector. Each stock’s contribution is calculated as its return multiplied by its market cap, then divided by the total market cap of the sector. This method reflects the performance of each sector as influenced by the size of its individual constituents.

X-axis shows 5-day return. Y-axis shows 1-month return. Bubble size reflects the total sector market cap.

*Data source:* [*barchart.com*](http://barchart.com/) *• Not financial advice • For educational use only*
Energy surges, Tech rebounds, and everything else slumps.

• **Energy (EN)** led again; up **+2.8% this week**, **+6.8% month-to-date**  
• **Tech (IT)** posted solid recovery, **+3.9% 1-month**, despite a flat 5D return  
• **Health Care (HC)** and **Communication Services (CM)** hit hardest, both down over **3%** in 5D  
• 8 of 11 sectors in the red for the week as momentum narrows",19,0.89,1,0,refreshpreview,stockmarket,['C'],sp 500 market capweighted returns sector week ending 20 jun 2025 market capweighted returns returns represent market capweighted average gics sector stocks contribution calculated return multiplied market cap divided total market cap sector method reflects performance sector influenced size individual constituents xaxis shows 5day return yaxis shows 1month return bubble size reflects total sector market cap data source barchartcom financial advice educational use energy surges tech rebounds everything else slumps energy en led 28 week 68 monthtodate tech posted solid recovery 39 1month despite flat 5d return health care hc communication services cm hit hardest 3 5d 8 11 sectors red week momentum narrows
1lhjuug,2025-06-22,"What happened to NCNA?
Down more than 90% in the last months... Market manipullation or lack of results? Time to buy?... What do you think about the company? Some analysts point to 20 - 25 until the end of the year, but it seems too bullish... CEO Hugh S.Griffith Will Be Taking A Leave Of Absence Due To Health Reasons...

Does this submission fit our subreddit? If it does please **upvote** this comment. If it does not fit the subreddit please **downvote** this comment.



---

^(*I am a bot, and this comment was made automatically.*) ^(Please) [^(contact)^( )^(us)^( )^(via)^( )^(modmail)](https://www.reddit.com/message/compose?to=/r/pennystocks&subject=Updoot%20bot%20questions!) 
^(if) ^(you) ^(have) ^(any) ^(questions) ^(or) ^(concerns.) I have 1,500 shares at 0.018 and just want out. 😔 I averaged down last week. Then Friday’s loss made me just about sick. I’m waiting to get out as well! Check the website lastest data published bullish. Share holder meeting this Friday 27th June

[nucana ncna ](https://www.nucana.com/nuc7738.html)",7,0.89,4,0,zeronothingplus,pennystocks,['C'],happened ncna 90 last months market manipullation lack results time buy think company analysts point 20 25 end year seems bullish ceo hugh sgriffith taking leave absence due health reasons submission fit subreddit please upvote comment fit subreddit please downvote comment bot comment made automatically please contact us via modmail questions concerns 1500 shares 0018 want averaged last week fridays loss made sick im waiting get well check website lastest data published bullish share holder meeting friday 27th june nucana ncna
