id,date,full_text,score,upvote_ratio,num_comments,total_awards_received,author,subreddit,tickers,cleaned_text
1lhjxii,2025-06-22,"Anyone else here self-taught in managing their own investments after a windfall or inheritance? How’s it going for you?
Hi all, I’m in my late 20s, working a pretty standard tech job (did a few years in retail before that). Sometime last year, I was fortunate enough to receive a mid to high 5 figure inheritance from family. At first, I let the bank’s advisors handle it, but honestly the returns were pretty underwhelming. So I decided to start learning on the side on my own. Taught myself the basics of investing, lots of youTube, books and lurking on this sub haha.

Fast forward to a year now, and I’ve managed to grow my little inheritance to just over six figures. Nothing crazy, but I’m pretty proud considering I started with zero experience and just learned as I went. I’m still keeping things pretty conservative (mostly index funds, some blue-chip stocks, and a bit of crypto for fun).

My main goal is to save up for a down payment on a property in the next few years, so I’m trying to balance growth with not taking on too much risk.

Curious if anyone else here is in a similar boat, either got a windfall, received an inheritance or just decided to take the DIY route with their investments. How’s it going for you? How long have you been managing your own portfolio, and what’s been your biggest lesson so far?

Would love to hear some stories, tips, or even just cheer each other up about the learning curve, process, etc. Thanks!
If you have no experience, just put it into a SP500 or global index fund. Requires no skills, no time, and you beat 90% of investors. ETF. done.  
Sub resources. Self-taught investor post windfall. So far, so good! no windfall here, just learning about anything there is, and doing really well, my first investment ever was a 5 year railroad bond, with a 10% interest rate and they sold it for 95% , never looked back after that. if you want to invest in equities, just make sure to get to know the companies first. Man, reading this felt like flipping through a page of my own story. I’m not gonna lie — I didn’t start with an inheritance, but back when I dropped out of uni, I had this random lump sum from selling off some leftover inventory from an old side hustle. It was like £30K. Didn’t sound like much at the time, but to me? It was everything. No one in my family ever talked stocks or investing, so I had to self-teach *everything*. YouTube deep dives, late-night Reddit threads, even those beginner investing PDFs floating around — I soaked it all in.

At first, I did exactly what you did — let the bank “manage” it, and yeah… underwhelming returns is putting it *kindly*. Once I took it into my own hands and shifted into ETFs, blue-chip stocks, and eventually a bit of ETH and BTC on the side, things actually started growing. Over the next few years, that little stash snowballed into mid-six figures. Best part? The confidence it gave me. Not even just the returns — just knowing *I did that*, brick by brick.

What actually surprised me was letting a crypto investment manager handle a small altcoin portfolio on the side — I’m talking just mid-four figures — but the way he rotated into certain alts during key runs turned that slice into a sneaky little passive income machine. Totally hands-off for me, and it’s actually been one of the most consistent earners in the background.

Biggest lesson for me? Emotions can wreck you if you’re not careful. I once sold during a dip thinking I was protecting myself… only to miss the rebound two weeks later. So now I try to zoom out, stick to the plan, and trust the long-term plays. You’re doing amazing already — especially balancing growth with the goal of a down payment. That’s smart, not boring.

Curious though — what’s been your biggest “a-ha” moment since going solo? Was there a turning point where it all just started to click for you? Investing well, thanks! This reads like AI wrote it I was in the same situation. Had my I heritance being managed by a team, but was paying over a hundred dollars a month in fees. So I moved it to a self managed account and it's in low cost index funds.


Originally it was in stupid ETFs like a growth, SP500, and value which doesn't make sense because all the ETFs together would have the same effect a 60/40 asset allocation fund.


I primarily employ a combo of low volitility ETFs and dividend ETFs to hopefully smooth out the dips.


I avoided the heavy 40% in bonds because if you look at the bond market it was doing really poorly the past couple of years.


With the announcement of possible interest rate cuts, it looked like the 60/40 portfolio is set to make a comeback.  One whole year and claiming victory already huh. Lol. How many weeks of underwhelming performance could pro management have had?

I doubt there is a single bond in your portfolio if it grew enough for you to brag about in a year. Zero fixed income and some crypto means it ain’t conservative. Lol. 

It’s fine. As long as you don’t panic sell you should be good. One year is too small a size to tell. 

Hopefully you are constantly adding. DCA is the move. Best of luck. Truly. I learned a lot of what not to do.",12,0.87,10,0,rossquincy007,investing,['C'],anyone else selftaught managing investments windfall inheritance hows going hi im late 20s working pretty standard tech job years retail sometime last year fortunate enough receive mid high 5 figure inheritance family first let banks advisors handle honestly returns pretty underwhelming decided start learning side taught basics investing lots youtube books lurking sub haha fast forward year ive managed grow little inheritance six figures nothing crazy im pretty proud considering started zero experience learned went im still keeping things pretty conservative mostly index funds bluechip stocks bit crypto fun main goal save payment property next years im trying balance growth taking much risk curious anyone else similar boat either got windfall received inheritance decided take diy route investments hows going long managing portfolio whats biggest lesson far would love hear stories tips even cheer learning curve process etc thanks experience put sp500 global index fund requires skills time beat 90 investors etf done sub resources selftaught investor post windfall far good windfall learning anything really well first investment ever 5 year railroad bond 10 interest rate sold 95 never looked back want invest equities make sure get know companies first man reading felt like flipping page story im gonna lie didnt start inheritance back dropped uni random lump sum selling leftover inventory old side hustle like 30k didnt sound like much time everything one family ever talked stocks investing selfteach everything youtube deep dives latenight reddit threads even beginner investing pdfs floating around soaked first exactly let bank manage yeah underwhelming returns putting kindly took hands shifted etfs bluechip stocks eventually bit eth btc side things actually started growing next years little stash snowballed midsix figures best part confidence gave even returns knowing brick brick actually surprised letting crypto investment manager handle small altcoin portfolio side im talking midfour figures way rotated certain alts key runs turned slice sneaky little passive income machine totally handsoff actually one consistent earners background biggest lesson emotions wreck youre careful sold dip thinking protecting miss rebound two weeks later try zoom stick plan trust longterm plays youre amazing already especially balancing growth goal payment thats smart boring curious though whats biggest aha moment since going solo turning point started click investing well thanks reads like ai wrote situation heritance managed team paying hundred dollars month fees moved self managed account low cost index funds originally stupid etfs like growth sp500 value doesnt make sense etfs together would effect 6040 asset allocation fund primarily employ combo low volitility etfs dividend etfs hopefully smooth dips avoided heavy 40 bonds look bond market really poorly past couple years announcement possible interest rate cuts looked like 6040 portfolio set make comeback one whole year claiming victory already huh lol many weeks underwhelming performance could pro management doubt single bond portfolio grew enough brag year zero fixed income crypto means aint conservative lol fine long dont panic sell good one year small size tell hopefully constantly adding dca move best luck truly learned lot
1lhimqs,2025-06-22,"Daily General Discussion and Advice Thread - June 22, 2025
Have a general question? Want to offer some commentary on markets? Maybe you would just like to throw out a neat fact that doesn't warrant a self post? Feel free to post here!

Please consider consulting our FAQ first - [https://www.reddit.com/r/investing/wiki/faq](https://www.reddit.com/r/investing/wiki/faq) And our [side bar](https://www.reddit.com/r/investing/about/sidebar) also has useful resources.

If you are new to investing - please refer to Wiki - [Getting Started](https://www.reddit.com/r/investing/wiki/index/gettingstarted/)

The reading list in the wiki has a list of books ranging from light reading to advanced topics depending on your knowledge level. Link here - [Reading List](https://www.reddit.com/r/investing/wiki/readinglist)

The media list in the wiki has a list of reputable podcasts and videos - [Podcasts and Videos](https://www.reddit.com/r/investing/wiki/medialist)

If your question is ""I have $XXXXXXX, what do I do?"" or other ""advice for my personal situation"" questions, you should include relevant information, such as the following:

* How old are you? What country do you live in?
* Are you employed/making income? How much?
* What are your objectives with this money? (Buy a house? Retirement savings?)
* What is your time horizon? Do you need this money next month? Next 20yrs?
* What is your risk tolerance? (Do you mind risking it at blackjack or do you need to know its 100% safe?)
* What are you current holdings? (Do you already have exposure to specific funds and sectors? Any other assets?)
* Any big debts (include interest rate) or expenses?
* And any other relevant financial information will be useful to give you a proper answer.

Check the resources in the sidebar.

Be aware that these answers are just opinions of Redditors and should be used as a starting point for your research. You should strongly consider seeing a registered investment adviser if you need professional support before making any financial decisions!
need some portfolio advice

I am 16 nearly 17 in Western Australia and i have $6000 in investments (69% in Vanguard High Growth Index, 6% in NDQ, and 25% in IOO).

I can add around $300 every couple of months with the amount i am working at the moment so wondering where i should put it into, are these the right choice?",1,1.0,1,0,AutoModerator,investing,['C'],daily general discussion advice thread june 22 2025 general question want offer commentary markets maybe would like throw neat fact doesnt warrant self post feel free post please consider consulting faq first side bar also useful resources new investing please refer wiki getting started reading list wiki list books ranging light reading advanced topics depending knowledge level link reading list media list wiki list reputable podcasts videos podcasts videos question xxxxxxx advice personal situation questions include relevant information following old country live employedmaking income much objectives money buy house retirement savings time horizon need money next month next 20yrs risk tolerance mind risking blackjack need know 100 safe current holdings already exposure specific funds sectors assets big debts include interest rate expenses relevant financial information useful give proper answer check resources sidebar aware answers opinions redditors used starting point research strongly consider seeing registered investment adviser need professional support making financial decisions need portfolio advice 16 nearly 17 western australia 6000 investments 69 vanguard high growth index 6 ndq 25 ioo add around 300 every couple months amount working moment wondering put right choice
1lhf447,2025-06-22,"Can someone help out pyschologically with a struggle re: lost money?
I am of ethnic minority and help two elderly females for whome I'm biologically / related next of kin to ensure that they have a good retirement/quality of life/less money issues. They aren't rick but with careful help I hope for them to feel comfortable and have decent quality of life.

  
I'm beating myself over a decision where I didn't do it myself and tried to guide them to protect their assests money. The assest was in a foreign country and the value of currency depreciated greately despite me trying hard to tell them to take care of it, change it etc. They live now in a western country with the high cost of living. 

  
The total loss was 35K but I imagine that even if I did my best and did myself, I would have likely had 7k-15k by the time i got there etc so in total the loss is about 25K. 

I feel bad that they missed out the interst rate (high) or some gains in the stock market or SPY(50% Sin the last 3 years). 

It's made me bitter that there's some gender dynamics at play - women's money is not considered as worth it or elderly female's money isn't considered as requiring care unless they have a strong advocate etc.

  
How should I think about it differently ? Realize that the net loss was actually not 35k but more like 25k is more tolerable (taking it account that I would have still lost 7-15k anyways ) was good way to think.

Should I be grateful that I stepped in when I did versus years later when the assest (foreign currency to dollar) would have been even more worthless?

Is it just part of being an investor that sometimes despite knowing everything and knowing that the market is down, it's time to invest, you have a source of funds - but it ends up not happening? I guess if i look back at other periods of my life, I would have been a millionare if I invested X amount in 2009 when I had the funds and a way to do it,etc?

Can someone more experienced say something to help my psychological pain and regret and sadness? It's just part of being investort to have these experiences?
Honestly I read all this and still have no idea what you're talking about. I do feel for you though, on the part of being in the ethnic minority, and feeling like you do not have the systemic advantages that others do. On the other hand, complaining about it or feeling sorry for yourself won't do anything to change it either. Can you please just say the country, no ones gonna dox you, no one can help you like this You cant change the past Wtf? If they live in the USA, their assets should be predominately tied to the US currency. This isnt true for any other country, since the US is so dominant in the global market cap. But, generally you want to overweight the countries markets you live in to hedge future consumption in that currency and tied to that market. I have no idea what youre talking about No sense looking back, not like its gonna fix anything. Just do the best you can looking forward lies are easier without specifics to poke holes in Everyone faces losses.

The winners bounce back.

Slow down! Being cagey about the jurisdiction just makes you look full of shit",0,0.42,29,0,Better_Swimmer,investing,"['SPY', 'C']",someone help pyschologically struggle lost money ethnic minority help two elderly females whome im biologically related next kin ensure good retirementquality lifeless money issues arent rick careful help hope feel comfortable decent quality life im beating decision didnt tried guide protect assests money assest foreign country value currency depreciated greately despite trying hard tell take care change etc live western country high cost living total loss 35k imagine even best would likely 7k15k time got etc total loss 25k feel bad missed interst rate high gains stock market spy50 sin last 3 years made bitter theres gender dynamics play womens money considered worth elderly females money isnt considered requiring care unless strong advocate etc think differently realize net loss actually 35k like 25k tolerable taking account would still lost 715k anyways good way think grateful stepped versus years later assest foreign currency dollar would even worthless part investor sometimes despite knowing everything knowing market time invest source funds ends happening guess look back periods life would millionare invested x amount 2009 funds way itetc someone experienced say something help psychological pain regret sadness part investort experiences honestly read still idea youre talking feel though part ethnic minority feeling like systemic advantages others hand complaining feeling sorry wont anything change either please say country ones gonna dox one help like cant change past wtf live usa assets predominately tied us currency isnt true country since us dominant global market cap generally want overweight countries markets live hedge future consumption currency tied market idea youre talking sense looking back like gonna fix anything best looking forward lies easier without specifics poke holes everyone faces losses winners bounce back slow cagey jurisdiction makes look full shit
1lhf3tn,2025-06-22,"Should I add Roth and/or IRA to my portfolio?
I have more or less these in my family's portfolio: 

40k in cash
120k in ETFs
400k in combined retirement accounts 457 and 401k.

Both me and the wife have government jobs that have pensions...I myself can retire in 10 years. Hopefully my house will be paid in 11 years.

My question is am I missing anything by not having a Roth or IRA? 

I am paying low interest rates on my mortgage so I basically have minimal deduction from it.  So I'm maxing out as much as I can on contributions to the 457 and 401k to take advantage of the tax deferment.

Any advice? Thanks!
You got some reading to do based on how you’re referring to “Roth or IRA” That 120k… is that just in a brokerage account? If so, then yes, you are missing out by not having an IRA. Contribute to a traditional IRA if you want the tax benefit now; contribute to a Roth IRA if you want the tax benefit later. Roth lets you withdraw invested amount tax free.. I should have clarified that outside of the 401k/457 tax deferred contributions, I don't have any others like Roth contributions, regular IRAs of Roth IRAs.  I know about the tax implications of Roth at the very least. Yeah it's just in brokerage. I haven't been putting more into it in the past few years because life happened, just into the 457 and 401k. I am trying to keep that much liquid assets just in case. Yes, diversify with Roth and IRA.",3,0.72,6,0,prey4mojopotatoes,investing,['C'],add roth andor ira portfolio less familys portfolio 40k cash 120k etfs 400k combined retirement accounts 457 401k wife government jobs pensionsi retire 10 years hopefully house paid 11 years question missing anything roth ira paying low interest rates mortgage basically minimal deduction im maxing much contributions 457 401k take advantage tax deferment advice thanks got reading based youre referring roth ira 120k brokerage account yes missing ira contribute traditional ira want tax benefit contribute roth ira want tax benefit later roth lets withdraw invested amount tax free clarified outside 401k457 tax deferred contributions dont others like roth contributions regular iras roth iras know tax implications roth least yeah brokerage havent putting past years life happened 457 401k trying keep much liquid assets case yes diversify roth ira
1lhcpym,2025-06-22,"What are your opinions on gold after the US decided to enter into war?
I feel like low key gold could high key be an excellent investment given the instability in the middle east and the fact that the most powerful nation in the world decided to get involved in the conflict. Regardless of whether or not you support those guys having WMDs, it's certainly alarming to see the recent escalation. It makes me think that we could see $5000 gold by the end of the year. I think it could be a very promising move, at least in the near term. Opinions?
Semantics.  The US hasn't formally declared war against a nation since 1942, but that didn't keep us from invading two countries and spending 20 years in Afghanistan. There will be headlines, stocks will over react, good time to buy with any cash or bonds you got. America bombs shit all the time bro. This is that panic they always warn ya about We have not “entered into war”, if you are meaning declaring war. Trump does not have that authority. But to answer your question, yes, I could see commodities doing well if things continue to escalate further. Time will tell. You’re right, I don’t disagree with you and have no argument against you on that. But it’s worth keeping the record straight to prevent the spread of bad information, even if by accident or mistake. Idk if the perpetual wars have desensitized you but attacking another nation is war, whether or not there’s an official declaration

That said gold isnt hitting 5k lol https://youtu.be/vl156QpXr5g?si=EwZGFuZtRjxpnDAr

Gold might see an uptick, but it's usually short lived. In terms of what to invest in, as long as US soil isn't getting directly attacked then equities tend to be safe and will normally recover within a year.

Expect global GDP to drop so it will have an overall effect, but usually countries not involved are the safest choice. Yeah, but usually it’s some ragtag terrorist group or some fringe army in some desert somewhere. It’s rare they bomb a major military power. Bombing Iran is not like bombing the Houthis or ISIS. The last time we did something like this was in Libya—and Libya was at least in the middle of a civil war. Hard to think of anything comparable for a generation.  Do me a favor and read about WWI…  the writing was on the wall, but somehow all decision makers missed the obvious outcome.  Everyone with a defense treaty will get sucked in or risk breaking the treaty.  I hope cooler heads prevail as we know the US is not the grownup in the world stage anymore.",0,0.44,58,0,bobjohndaviddick,investing,['C'],opinions gold us decided enter war feel like low key gold could high key excellent investment given instability middle east fact powerful nation world decided get involved conflict regardless whether support guys wmds certainly alarming see recent escalation makes think could see 5000 gold end year think could promising move least near term opinions semantics us hasnt formally declared war nation since 1942 didnt keep us invading two countries spending 20 years afghanistan headlines stocks react good time buy cash bonds got america bombs shit time bro panic always warn ya entered war meaning declaring war trump authority answer question yes could see commodities well things continue escalate time tell youre right dont disagree argument worth keeping record straight prevent spread bad information even accident mistake idk perpetual wars desensitized attacking another nation war whether theres official declaration said gold isnt hitting 5k lol gold might see uptick usually short lived terms invest long us soil isnt getting directly attacked equities tend safe normally recover within year expect global gdp drop overall effect usually countries involved safest choice yeah usually ragtag terrorist group fringe army desert somewhere rare bomb major military power bombing iran like bombing houthis isis last time something like libyaand libya least middle civil war hard think anything comparable generation favor read wwi writing wall somehow decision makers missed obvious outcome everyone defense treaty get sucked risk breaking treaty hope cooler heads prevail know us grownup world stage anymore
