id,date,full_text,score,upvote_ratio,num_comments,total_awards_received,author,subreddit,tickers,cleaned_text
1lhlay6,2025-06-22,"Question for experienced about spy.
Ok so i developed my own model because..  why not but everything seems about right so i want to make a bet on it's validity. I plan to invest around $1k since I'm poor and from Poland and hope to improve my finances this way. I want to bet on spy dipping at around 15% somewhere between october and December and I'm not sure what would be the most profitable way to do so. Short sell etf, or maybe some options like sell call... Can you help me make the best of this idea?
For anyone who wants to look at my model you can do so in here: https://atbt.eu/metc
Why bet drop so much late? I mean a safe approach would be buy 3-week out SPX puts. We are on ATH, and obviously we won't pass it with current valuation levels while all polls says economic is slowdowning. And if Iran attacks US tonight then is a must the buy. If Iran closes Ormuz, a buy is a must. If nothing happend today then don't short market as it might go up. Buy puts 2% price lower current price to get a fair ammount with not much risk Watch the money guy show. Buy swppx every time you get a paycheck. Focus on finding ways to improve income.",0,0.4,3,0,tomaszeek,stocks,"['SPY', 'C']",question experienced spy ok developed model everything seems right want make bet validity plan invest around 1k since im poor poland hope improve finances way want bet spy dipping around 15 somewhere october december im sure would profitable way short sell etf maybe options like sell call help make best idea anyone wants look model bet drop much late mean safe approach would buy 3week spx puts ath obviously wont pass current valuation levels polls says economic slowdowning iran attacks us tonight must buy iran closes ormuz buy must nothing happend today dont short market might go buy puts 2 price lower current price get fair ammount much risk watch money guy show buy swppx every time get paycheck focus finding ways improve income
1lhk6ih,2025-06-22,"Next best OKLO buy in?
So US hit Iranian nuclear sites so would this have short term stress on OKLO or will OKLO manage to hold it out and keep climbing? And would OBBBA be impactful enough on OKLO to reduce its stock or is it more resilient? I'd assume if OBBBA gets rid of environmental tax credits, it could hurt OKLO in their next earnings but I don't know how that could work since OKLO isn't making money. I'm just trying to find a good price to buy in shares and hoping the stock plummets again after this short term hype to make the most of my money. 
Its a highly speculative stock. I like it but trying to work out what its share price is going to do will be simply guessing. Hasn't even got close to building its first aurora reactor yet. 

If you buy it, just know you're holding it for 5, maybe 10 years min and it's going to be bumpy. Stock was overbought, has come down recently to the upper 50's, does it hold the 20 day moving average ($54 and change)?

If the market is down substantially Monday could certainly see the more speculative stuff (like Oklo, which won't be generating revenue until around 2027) down with it but feels like there's still momentum buyers that would probably step in for all this kind of stuff. OKLO was smart to do an offering a week or two ago with the stock near highs.  

Probably won't be the last one if the buying continues this year - any company that is early or relatively early stage should be considering equity raises in this market. If there's such demand for the stock, raise $ as further cushion in a world where things can change quickly.

OKLO also isn't without comeptition. Hovr If they continue to make offering would the stock continue to go down. And the thing I don't understand is how would this impact earnings report. If they're still in the negatives by Q2 would stock go down or stay up as long as they beat the expected eps even if it's negative? > If they continue to make offering would the stock continue to go down.

If they sell more stock, the shares will go down but if people actually do believe in the company long-term and you have a situation where they won't even have anything built/running until 2027, it's not a bad thing to have as much money as possible to be able to comfortably navigate all the issues that may come up between here and there. 

""If they're still in the negatives by Q2 would stock go down or stay up as long as they beat the expected eps even if it's negative?""

They're losing money and won't be building anything that generates money until 2027. I think what most people are going to look for in an earnings report from a company like this are new details. Did they sign new deals? Stock up. Is there going to be a delay? Stock down. If a stock is up 165% YTD (which this is) and they're not going to have revenue until 2027 and they announce some sort of negative news,  that is what could send this materially lower. 

In other words, the market expects ""we lost more money"" and will probably overlook that if it's to a reasonable degree. The market will not overlook if they go ""Oh and by the way we thought 2027 and now that looks like early 2028.""",0,0.38,5,0,Derpy_Mc_Burpy,stocks,['C'],next best oklo buy us hit iranian nuclear sites would short term stress oklo oklo manage hold keep climbing would obbba impactful enough oklo reduce stock resilient id assume obbba gets rid environmental tax credits could hurt oklo next earnings dont know could work since oklo isnt making money im trying find good price buy shares hoping stock plummets short term hype make money highly speculative stock like trying work share price going simply guessing hasnt even got close building first aurora reactor yet buy know youre holding 5 maybe 10 years min going bumpy stock overbought come recently upper 50s hold 20 day moving average 54 change market substantially monday could certainly see speculative stuff like oklo wont generating revenue around 2027 feels like theres still momentum buyers would probably step kind stuff oklo smart offering week two ago stock near highs probably wont last one buying continues year company early relatively early stage considering equity raises market theres demand stock raise cushion world things change quickly oklo also isnt without comeptition hovr continue make offering would stock continue go thing dont understand would impact earnings report theyre still negatives q2 would stock go stay long beat expected eps even negative continue make offering would stock continue go sell stock shares go people actually believe company longterm situation wont even anything builtrunning 2027 bad thing much money possible able comfortably navigate issues may come theyre still negatives q2 would stock go stay long beat expected eps even negative theyre losing money wont building anything generates money 2027 think people going look earnings report company like new details sign new deals stock going delay stock stock 165 ytd theyre going revenue 2027 announce sort negative news could send materially lower words market expects lost money probably overlook reasonable degree market overlook go oh way thought 2027 looks like early 2028
1lhg29q,2025-06-22,"Is TLT now a good play with the Iran conflict?
Is TLT the great thing to do, bonds? 

  
TLT has been a safe haven. They say treasuries aren't safe. There is so much noise that I can't identify a solid strategy for stability. Will people flock to bonds for stability with so much going on?
It's not a stable market. The money will flow into gold and precious metals. Watch... Monday gold is gonna moon Not TLT. No very dangerous play, if it leads to a bigger conflict the deficit is going to explode even more so during good economy and during turmoil the usd usually skyrockets but now its dumping Verizon is stable. Nobody giving up their connection. Cash flow machine. Yields 6.5% versus the 4 odd percent you get with Treasury bonds. 


Has massive debt but the 5g spend is almost over. At least it's not 36T. If you see the word ""6g"" sell immediately.  understated Hasn’t acted like a true safe haven. Yields dipped then bounced. Can’t see interest rates rising given the economic damage at far, even if it’s inflationary as Powell says.

If he cranks it up, it’ll be like dominoes for the economic collapse. 

Plus you have to expect a pliable stooge to come in after Powells term is up, with the sole mandate : lower interest rates. (As he was initially with the fast and loose stimmy packages…)

Long dated treasury bonds, (to me), is the only is the only thing with a little certainty.

Besides, 5% coupon value if they hold flat is nothing to sniff at.

And this is all without whatever the Iran conflict will create (just flat out up and down stability).

My only concern is that Trump-economic of tax cuts / overspending before a ridiculous budget is signed / and a money-dump military conflict in the horizon; how strong can US treasuries remain?

Maybe inflation protected bonds is the real ‘play’???
Or just have bonds as part of a balanced portfolio like a normal person. Bonds at almost 5% do hold up to inflation, not to mention if you anticipate cuts the prices jump and you can exit profitably, one reason I think the fed has been content to buy them lately not only to save auctions but they know their future plans as well The cuts at BLS aren't defunding. The data quality isn't that much worse (for now).",23,0.85,29,0,herbertisthefuture,stocks,['C'],tlt good play iran conflict tlt great thing bonds tlt safe say treasuries arent safe much noise cant identify solid strategy stability people flock bonds stability much going stable market money flow gold precious metals watch monday gold gonna moon tlt dangerous play leads bigger conflict deficit going explode even good economy turmoil usd usually skyrockets dumping verizon stable nobody giving connection cash flow machine yields 65 versus 4 odd percent get treasury bonds massive debt 5g spend almost least 36t see word 6g sell immediately understated hasnt acted like true safe yields dipped bounced cant see interest rates rising given economic damage far even inflationary powell says cranks itll like dominoes economic collapse plus expect pliable stooge come powells term sole mandate lower interest rates initially fast loose stimmy packages long dated treasury bonds thing little certainty besides 5 coupon value hold flat nothing sniff without whatever iran conflict create flat stability concern trumpeconomic tax cuts overspending ridiculous budget signed moneydump military conflict horizon strong us treasuries remain maybe inflation protected bonds real play bonds part balanced portfolio like normal person bonds almost 5 hold inflation mention anticipate cuts prices jump exit profitably one reason think fed content buy lately save auctions know future plans well cuts bls arent defunding data quality isnt much worse
1lhewq2,2025-06-22,"Historical Prices vs Historical Performance Claims
I need some help on the stock system as a whole. I'm doing some research on stock price history. 

In the period from 1980 to 1990, several stocks were considered ""best performers"", including USB, Circuit City, Nike, and some others. Nike is listed as having a 23,000% return. Circuit City was supposed to have a 90x return. USB is listed as a 22,000% return. 

But when I review the historical prices... I don't see where those returns come from. 

Take USB:  
Jan 1980 price about $0.70   
Dec 1989 price about $2.35 (3x increase)

Stock splits  
1984 1.1 for 1  
1985 2 for 1  
1989 2 for 1 (roughly 5.5x cumulative)

All that together is roughly a 1500% return. 

There are dividends, roughly quarterly. So that might account for it. Some are into the forty cents a share and some are not even a dime per share. 

NIKE is even worse though.   
Jan 1981 price about $0.16  
Dec 1989 price about $0.87 (5.5x increase)

1x 2:1 stock split in the entire decade

6x $0.10 and 1x $0.15 dividend the entire decade. 

How does anyone get a 23000% return from that? 

What am I missing? 


> In the period from 1980 to 1990, several stocks were considered ""best performers"", including USB, Circuit City, Nike, and some others. Nike is listed as having a 23,000% return. Circuit City was supposed to have a 90x return. USB is listed as a 22,000% return.

Where are you getting these return numbers from? They sound like nonsense Nice",0,0.5,2,0,OgreMk5,stocks,['C'],historical prices vs historical performance claims need help stock system whole im research stock price history period 1980 1990 several stocks considered best performers including usb circuit city nike others nike listed 23000 return circuit city supposed 90x return usb listed 22000 return review historical prices dont see returns come take usb jan 1980 price 070 dec 1989 price 235 3x increase stock splits 1984 11 1 1985 2 1 1989 2 1 roughly 55x cumulative together roughly 1500 return dividends roughly quarterly might account forty cents share even dime per share nike even worse though jan 1981 price 016 dec 1989 price 087 55x increase 1x 21 stock split entire decade 6x 010 1x 015 dividend entire decade anyone get 23000 return missing period 1980 1990 several stocks considered best performers including usb circuit city nike others nike listed 23000 return circuit city supposed 90x return usb listed 22000 return getting return numbers sound like nonsense nice
1lhejul,2025-06-22,"Predictions for Monday's Market.
“Oil is sure to spike on this initial news.""

An increase in oil price will likely lead to a spike in EV stocks (EV becomes more appealing with rising oil prices).

""I think it’s going to be very positive for the stock market,"" due to a decrease in uncertainty on the US stance.

""Likely to cause a selloff in equities and a possible bid for the dollar and other safe-haven assets when trading begins.""

[https://finance.yahoo.com/news/investors-react-us-attack-iran-004412666.html](https://finance.yahoo.com/news/investors-react-us-attack-iran-004412666.html)

[https://www.reuters.com/business/energy/middle-east-tensions-put-investors-alert-weighing-worst-case-scenarios-2025-06-21/](https://www.reuters.com/business/energy/middle-east-tensions-put-investors-alert-weighing-worst-case-scenarios-2025-06-21/)
Premarket drop. Retail chase’s puts at open, close over SPY 600 Do you have a newsletter or anything?  With insights like this I can beat the market! Some stocks will go up and some will go down. Others will remain unchanged by closing. I'm going to go with Lululemon calls. Let me explain, soldiers need to be comfortable under all that gear, normally you would think under armor or nike, but Lululemon has been slowly taking over that market. 

Think about it, you're about to go to war. Wouldn't you feel nice and crispy in some Lululemon?

Edit - it's a joke I'm going general dynamics and Oil buys Yeah, Iran can't do much to us now. We should invade, spend 20 years there, and then leave the country in the hands of the people we were fighting.

America craves another loss. We need to add to the Vietnam and Afghanistan Ls we took. Ask yourself….does the U.S. bombing three sites in Iran make you want to sell your stock?  Does it have any effect on what you believe future earnings will be on any of the companies stock you own?  The vast majority of stocks are held by the richest companies and individuals and I can’t imagine them selling based on this news.  This isn’t Iraq or Afghanistan.  Iran needs oil to rebuild so I bet a deal is reached pretty quickly.  It isn’t like they are being asked to give up territory. https://www.news18.com/world/iran-calls-for-missile-strike-us-fleet-closure-strait-of-hormuz-khamenei-reaction-greater-damager-america-9397788.html

Looks like oil will rocket. Markets will definitely dive on Monday good buying opportunity. Definitely gapping down with a straight up V pump into close. This is the most naive thing I have ever heard. Of course they have capability left. They have access to terror cells around the world. I would be shocked if something fairly big doesn't happen in the next 48 hours. Strait of Hormuz likely closed",144,0.89,146,0,Progress_8,stocks,['C'],predictions mondays market oil sure spike initial news increase oil price likely lead spike ev stocks ev becomes appealing rising oil prices think going positive stock market due decrease uncertainty us stance likely cause selloff equities possible bid dollar safehaven assets trading begins premarket drop retail chases puts open close spy 600 newsletter anything insights like beat market stocks go go others remain unchanged closing im going go lululemon calls let explain soldiers need comfortable gear normally would think armor nike lululemon slowly taking market think youre go war wouldnt feel nice crispy lululemon edit joke im going general dynamics oil buys yeah iran cant much us invade spend 20 years leave country hands people fighting america craves another loss need add vietnam afghanistan ls took ask yourselfdoes us bombing three sites iran make want sell stock effect believe future earnings companies stock vast majority stocks held richest companies individuals cant imagine selling based news isnt iraq afghanistan iran needs oil rebuild bet deal reached pretty quickly isnt like asked give territory looks like oil rocket markets definitely dive monday good buying opportunity definitely gapping straight v pump close naive thing ever heard course capability left access terror cells around world would shocked something fairly big doesnt happen next 48 hours strait hormuz likely closed
1lhediu,2025-06-22,"Is Ferrari a good stock?
I'm not familiar with the car much but I do know that for rich folks owning Ferrari is a matter of prestige and a way to signal wealth. 

With ICE cars in secular decline, do you think EV Ferrari would hold the same strong brand presence and social significance?. 

Or would ICE Ferrari cars get even more expensive and become like collectibles that are only  produced in limited quantities each year in a post-ice car world that are dominated by EVs? 

I'd love hear about what the community has to say. 
It’s definitely performing better than their F1 team at the moment. Incredible stock, incredible company. Worth doing DD Luxury and exotic markets aren’t typically affected by broader market as much. People with money have money. When I bought my first Ferrari I didn’t check how the economy was doing, I could afford it so I bought it. 

Company like Ferrari is truthfully recession proof. Auto manufacturers don’t typically smoke the broader market. Yet here we are. (Yes, Tesla does - different story)

Look beyond their cars, and at their branding, which is equally - or more - important than the product. 

PE ratios mean hardly anything anymore. Huh? It’s a fantastic stock historically. Zoom out. Not everything needs to make you tomorrow, it smoked the S&P the last 5 years Not if you want to make money. >a global economy that is on the down swing

Your typical 9-5 office worker or Starbucks barista buying a Ferrari in any economy? Counter argument: There will always be wealthy people regardless of the economy, they will always be able to buy exotic cars. Their backlog for orders goes back years. You do realize that the people buying Ferraris can lose half their wealth and still have enough to buy a 100 Ferraris? 

https://www.goodcarbadcar.net/ferrari-us-sales-figures/

Look at the sales figures from 2008-2011.

15% dip and back up. What do you base your stock purchases on ?
Gut feeling? Look at the data from 2019 -2021 then... it's all there..",0,0.26,31,0,Adventurous-Bet-9640,stocks,['C'],ferrari good stock im familiar car much know rich folks owning ferrari matter prestige way signal wealth ice cars secular decline think ev ferrari would hold strong brand presence social significance would ice ferrari cars get even expensive become like collectibles produced limited quantities year postice car world dominated evs id love hear community say definitely performing better f1 team moment incredible stock incredible company worth dd luxury exotic markets arent typically affected broader market much people money money bought first ferrari didnt check economy could afford bought company like ferrari truthfully recession proof auto manufacturers dont typically smoke broader market yet yes tesla different story look beyond cars branding equally important product pe ratios mean hardly anything anymore huh fantastic stock historically zoom everything needs make tomorrow smoked sp last 5 years want make money global economy swing typical 95 office worker starbucks barista buying ferrari economy counter argument always wealthy people regardless economy always able buy exotic cars backlog orders goes back years realize people buying ferraris lose half wealth still enough buy 100 ferraris look sales figures 20082011 15 dip back base stock purchases gut feeling look data 2019 2021
1lhcmp4,2025-06-22,"Time to buy defense stocks? SHLD? Lockheed Martin?
Trump just dropped a few bombs on Iran today. Is it time to throw some money in some defense stocks to make some easy $$$??

(Novice investor! I am just getting my feet wet so please don’t come for me) 

Bro you buy the rumor and sell the news, you should have bought a week ago for this play. We are pigs at the slough while our farmers feed us shit You’re already too late… this market isn’t rational.. they’re gonna drop on Monday Here for the comments. Trough? Slaughter? Marjorie Taylor-Greene is a better indicator these days. Could be… market may react that way.. but if no additional funds are budgeted.. it won’t matter War has been on the wind since Trump said he was running only oil and nat gas probably going up monday.  honestly, i think spy just gonna do -1% to -1.5% on monday. A lot of Americans seemed to believe him when he said he was the ""Peace President.""",126,0.71,120,0,Ambitious-Strength28,stocks,['C'],time buy defense stocks shld lockheed martin trump dropped bombs iran today time throw money defense stocks make easy novice investor getting feet wet please dont come bro buy rumor sell news bought week ago play pigs slough farmers feed us shit youre already late market isnt rational theyre gonna drop monday comments trough slaughter marjorie taylorgreene better indicator days could market may react way additional funds budgeted wont matter war wind since trump said running oil nat gas probably going monday honestly think spy gonna 1 15 monday lot americans seemed believe said peace president
1lhckos,2025-06-22,"USA bombed Iran. What's next for the market? SP500 and global
USA bombed Iran's nuclear sites 2 hours ago. Retaliations are expected. Hopefully it doesn't escalate too much.

How do you think this will affect the S&P 500 and global market? 

What's worth looking into or selling in your opinion?

[https://www.cnn.com/world/live-news/israel-iran-conflict-06-21-25-intl-hnk#cmc6vpmny000k3b6niyffgdws](https://www.cnn.com/world/live-news/israel-iran-conflict-06-21-25-intl-hnk#cmc6vpmny000k3b6niyffgdws)
Knowing how fucking screwed up the world has become. This is gonna be greener than grass. A short dump, followed by a euphoric pump when ""the most beautiful deal in history"" is announced. You just know there's gonna be people investing in defense stocks Nothing will happen because there won’t be anymore uncertainty about what will happen.  

Also Friday was triple witching so Monday there should be a lot of new open positions Gold gonna rock. And next week's Treasury auction will be LIT! Raytheon and Lockheed are loving this timeline! You could make the argument the US's involvement can make the war end sooner, so people can go back on business. So it make sense it would be green. But then again, Afghanistan, Iraq, or middle east in general is a sinking mudhole that dragged the US for decades. So it can also be red.

But but but, consider I bought calls last Friday, I can almost be certain it will be red on Monday. I have cash set aside waiting to buy RTX and OXY I don’t think anything matters anymore",2748,0.89,758,0,StevenZervos,stocks,['C'],usa bombed iran whats next market sp500 global usa bombed irans nuclear sites 2 hours ago retaliations expected hopefully doesnt escalate much think affect sp 500 global market whats worth looking selling opinion knowing fucking screwed world become gonna greener grass short dump followed euphoric pump beautiful deal history announced know theres gonna people investing defense stocks nothing happen wont anymore uncertainty happen also friday triple witching monday lot new open positions gold gonna rock next weeks treasury auction lit raytheon lockheed loving timeline could make argument uss involvement make war end sooner people go back business make sense would green afghanistan iraq middle east general sinking mudhole dragged us decades also red consider bought calls last friday almost certain red monday cash set aside waiting buy rtx oxy dont think anything matters anymore
