id,date,full_text,score,upvote_ratio,num_comments,total_awards_received,author,subreddit,tickers,cleaned_text
1lgzoi6,2025-06-21,"Brokerage with automatic buys and sells for income and expenses
I was wondering if there is a brokerage where I could set my paycheck to direct deposit in, have it automatically invested in ETFs, than sell as needed and setup it up to pay things like a credit card, does such an account exist, or anyway i could set up an account to do parts of this?
You shouldn’t be trading with funds that you need to pay bills the next month….

This is a terrible idea >than sell as needed and setup it up to pay things like a credit card?

Where is the money coming from if you’re not selling Please point out where you said “checking and other jobs” in the original post So you didn’t. And now are pissed off because people can’t read your mind? A regular taxable Fidelity account will do most or all of what you appear to want with no fees.

You can have direct deposit sent there and it will go to the settlement MMF. You can set up scheduled auto buys of ETFs and stocks. The money for purchases will draw from the settlement MMF. The settlement MMF (SPAXX) currently yields \~3.9%. The auto investments can also be set up to draw from a linked bank account.

The account also has optional access to paper checks, online bill pay, and a debit card. Those all draw from the settlement MMF. If you get their credit card that can be paid from the settlement MMF. There are no fees for the optional features.

You will have to find out from Fidelity how long they will hold direct deposits before the money can be withdrawn. IIRC, if you ACH transfer from your bank to Fidelity the hold is 7 days. If you initiate the ACH transfer at Fidelity to pull from your bank account the hold can be much longer. Don't do that. oh yeah, i am in college (for accounting and cybersecurity) and therefore can afford to mess up, but I know that this is the number one way to build wealth, some other guy just started to lecture me like i was an idiot, thanks for actually answering lol I saw his reply. I think you two misunderstood each other is all. 

He thinks you get paycheck for 2k. You set VOO auto buy for 2k. You set bill pay for credit card, so the account has to auto liquidate VOO to pay credit card. That would be no bueno and what he was describing. 

But it doesn’t have to be this way. Credit card is $500. Your direct deposit if 2k. Auto buy VOO for $500, 1500 is money market earning decent interest. Credit card or whatever is paid from money market. Fidelity is great for this. 

It beats using a regular bank that gives 0.03 on idle cash. 

He was just telling you not to constantly sell to pay bills. Which is correct (not smart tax wise). You will learn and find what works for you. 

But you are correct. You want to learn this early. Best of luck!! what is the focus of QQQM (i was going to split between VOO, VOOG, and SPY, but i know they are all ETFs with different focuses) Pretty much all of them honestly. Fidelity is extra easy. Set automatic buys for ETF’s you want. The extra money would be in their money market auto. 

You can direct deposit in there and bill pay from it. You would just need to make sure you don’t over invest and have enough in money market to handle the bill pay debits. 

Pretty much all of the big brokers do this. Just not sure what their policy is with spendable money market for idle cash. Most allow a daily/weekly/monthly scheduled deposit to auto buy in according to instructions. Mine will buy monthly a basket for ETFs in a set ratio. Any left over is earning interest until it reaches minimum buy ($100) for me.

I can set a sell and have it take a set proportion from the holdings to keep them in the proportions I set e.g. Withdraw $10k and it figures out how much of each holding to sell to get me $10k cash without changing ratio of holdings.",0,0.5,33,0,Spanconstant5,investing,['C'],brokerage automatic buys sells income expenses wondering brokerage could set paycheck direct deposit automatically invested etfs sell needed setup pay things like credit card account exist anyway could set account parts shouldnt trading funds need pay bills next month terrible idea sell needed setup pay things like credit card money coming youre selling please point said checking jobs original post didnt pissed people cant read mind regular taxable fidelity account appear want fees direct deposit sent go settlement mmf set scheduled auto buys etfs stocks money purchases draw settlement mmf settlement mmf spaxx currently yields 39 auto investments also set draw linked bank account account also optional access paper checks online bill pay debit card draw settlement mmf get credit card paid settlement mmf fees optional features find fidelity long hold direct deposits money withdrawn iirc ach transfer bank fidelity hold 7 days initiate ach transfer fidelity pull bank account hold much longer dont oh yeah college accounting cybersecurity therefore afford mess know number one way build wealth guy started lecture like idiot thanks actually answering lol saw reply think two misunderstood thinks get paycheck 2k set voo auto buy 2k set bill pay credit card account auto liquidate voo pay credit card would bueno describing doesnt way credit card 500 direct deposit 2k auto buy voo 500 1500 money market earning decent interest credit card whatever paid money market fidelity great beats using regular bank gives 003 idle cash telling constantly sell pay bills correct smart tax wise learn find works correct want learn early best luck focus qqqm going split voo voog spy know etfs different focuses pretty much honestly fidelity extra easy set automatic buys etfs want extra money would money market auto direct deposit bill pay would need make sure dont invest enough money market handle bill pay debits pretty much big brokers sure policy spendable money market idle cash allow dailyweeklymonthly scheduled deposit auto buy according instructions mine buy monthly basket etfs set ratio left earning interest reaches minimum buy 100 set sell take set proportion holdings keep proportions set eg withdraw 10k figures much holding sell get 10k cash without changing ratio holdings
1lgyxtm,2025-06-21,"Investment Advice for Retirement Accounts
I’m 31M with a 403b through work. They contribute 10% I contribute 5% for a 15% total and I currently have contributions going 100% in FXAIX and it has performed great so far. I also max out my Roth and current allocations are: 50% VTI, 30%QQQM, 10% FEPI, 10% TSLA. Wondering if I should get more aggressive with what I buy in my Roth (like buy more individual stocks) since I already have a solid set up in my 403b (that also overlaps) or if I should just stick the course.
I’d stick with what you’re doing. Also, god damn 10% from your employer, Jesus. Keep that job for sure. Mirror them.  Time is your friend.  Volatility is not.

Slow and steady wins the race.  Don't get FOMO.  If you feel the need to invest in ""hot stocks"" set a couple of grand aside in a brokerage and have at it their.  This way, you scratch that it but still keep building for the future.  I'd even pull the TSLA out of my Roth.  Index funds only. > 10% TSLA.

That's pretty aggressive. Hopefully your cost basis is very low. How long ago did you buy?

> Wondering if I should get more aggressive

Depends on your expertise, analysis of present conditions and the future, and - of course - your tolerance for risk.

> since I already have a solid set up in my 403b (that also overlaps) or if I should just stick the course.

You have to evaluate your holding as a whole, regardless of where they are. That's the starting point. Read the book The Income Factory.  The author uses dividned income to overlaying expenses.  At the author list 68 funds and several example portfolios.  There is also armchair income on you tube.  He list the 38 funds he uses and does detailed review of some of the funds.   Dividends can help retirment funds grow and can be used in any account. Agreed, got TSLA in 2020 so cost basis is ~$80 but might be time to move on from them I would hold on to TSLA.",2,1.0,6,0,Jonder326,investing,"['TSLA', 'C']",investment advice retirement accounts im 31m 403b work contribute 10 contribute 5 15 total currently contributions going 100 fxaix performed great far also max roth current allocations 50 vti 30qqqm 10 fepi 10 tsla wondering get aggressive buy roth like buy individual stocks since already solid set 403b also overlaps stick course id stick youre also god damn 10 employer jesus keep job sure mirror time friend volatility slow steady wins race dont get fomo feel need invest hot stocks set couple grand aside brokerage way scratch still keep building future id even pull tsla roth index funds 10 tsla thats pretty aggressive hopefully cost basis low long ago buy wondering get aggressive depends expertise analysis present conditions future course tolerance risk since already solid set 403b also overlaps stick course evaluate holding whole regardless thats starting point read book income factory author uses dividned income overlaying expenses author list 68 funds several example portfolios also armchair income tube list 38 funds uses detailed review funds dividends help retirment funds grow used account agreed got tsla 2020 cost basis 80 might time move would hold tsla
1lgysx6,2025-06-21,"Investing in energy transition projects
Hello,

I invested into projects on this platform : [https://fr.enerfip.eu](https://fr.enerfip.eu)

Rate : about 7% - local taxes.

There are other projects on [https://www.lumo-france.com](https://www.lumo-france.com), [https://www.lendopolis.com](https://www.lendopolis.com), [https://www.lendosphere.com](https://www.lendosphere.com) and https://miimosa.com.

Do you know other platforms like these?
You know they want your money because the bank told them they don't want to finance them ? Banks participate to these projects too. On Enerfip, none of the projects funded until now failed. Powering the future!",2,0.75,3,0,InfoLibre,investing,['C'],investing energy transition projects hello invested projects platform rate 7 local taxes projects know platforms like know want money bank told dont want finance banks participate projects enerfip none projects funded failed powering future
1lgyeji,2025-06-21,"Is it worth investing if I have very little upfront?
I’ve always been told to only invest what I’m willing to lose. With that in mind, I really can’t do more than a couple of thousand right now. Is it even worth it if that’s all I have to start with? Or should I continue to save and invest when I have more upfront? 

Also, is now a horrific time to begin investing considering the current politics? I know very little so would love to hear thoughts! 

Thank you!! 
The sooner you start the better. It will add up over time just never sell. Yes, every millionaire has to start somewhere. I started out saving/investing a few hundred a month in my early 20’s. Then a thousand a month. Then a few thousand a month. 12 years later and now I’m a millionaire. 

The only invest what you’re willing to lose advice only applies to risky stocks or crypto. It doesn’t apply to index funds like the S&P 500. Stock to index funds. 

It’s always a good time to invest. Doesn’t matter the president. Yes dont start selling until retirement is probably better advice for most people than ""never"" sell. Although if you are lucky enough to have more funds than you need in retirement then never selling could be prudent as you can transfer those securities to your heirs upon death tax free and with stepped up basis. Depends on your financial needs and goals. 

Assuming you have an emergency fund, paid off credit cards and overall in a decent spot, then 100% yes! Keep it simple, buy a low cost market ETF like VOO and just keep dollar cost averaging (aka buying) in strong and weak markets. 

The goal is not to need to pull money out during short term challenges ie down market, lost a job, need to pay the bills. The longer you can leave it, the more it compounds and snowballs. The first $10k is harder than the next. The first $100k is harder than the next. The first million is harder than the next!

Build some good habits, don’t let lifestyle inflation hit too much if you get a better paying job or see larger numbers in investment accounts, and good luck!!! You have to sell someday, otherwise what is the point Its like the marshmallow question we give kids to outline delayed gratification.

Would you rather have 1 marshmallow now or 3 marshmallows later?

If you have a 30 yr horizon and we are really lucky and get 7% real returns (10% nominal, 3% inflation), then your $2,000 now will multiply 7.6x (in todays dollars) or 17.5x nominally. That will be like having $15,224 in todays purchasing power.

If you wait to start investing next year, thats only 7.1x, so only $14,228. If you wait two years, thats 6.6x, so $13,297.

If you wait until 10 years away, you have more sequence of returns risk and even if you get that steady geometric return, youre only going to 1.97x your money in inflation adjusted terms, so you'd need to personally save much more to reach the same required nest egg.


Its difficult to think about, but every single dollar matters, and the earlier that dollar is invested, the more it will be worth in the future. You should absolutely invest extra money now, even if its not much. We live in the era of commission free brokerages Make sure you have an emergency fund in a high yield savings account. 

You don’t want to start buying index funds just to sell them 6 months later at a loss. 

As long as you have an emergency fund though, absolutely invest any amount you can. Do index funds, not individual stocks, and plan to basically never sell. You’re keeping those for decades. There’s never a better time to start than today. 

Remember “time in the market is better than timing the market.” Yes pick a low cost S&P 500 fund index fund like VOO and just buy as much as you can every month. The standard advice is to open a Roth IRA and contribute the max every year, and everything else put in a taxable brokerage account. Thank you so much for this!! That feels doable and less scary. Would love to hear your thoughts on where I should start- best to just throw it all in SPY and let it sit? VOO and SPY are super similar. I’d recommend VOO personally (or VTI, which is the whole market, not just the biggest 500 companies), but either of them is fine and is good enough. 

Don’t overthink it",40,0.79,167,0,glitter_n_grease,investing,['C'],worth investing little upfront ive always told invest im willing lose mind really cant couple thousand right even worth thats start continue save invest upfront also horrific time begin investing considering current politics know little would love hear thoughts thank sooner start better add time never sell yes every millionaire start somewhere started savinginvesting hundred month early 20s thousand month thousand month 12 years later im millionaire invest youre willing lose advice applies risky stocks crypto doesnt apply index funds like sp 500 stock index funds always good time invest doesnt matter president yes dont start selling retirement probably better advice people never sell although lucky enough funds need retirement never selling could prudent transfer securities heirs upon death tax free stepped basis depends financial needs goals assuming emergency fund paid credit cards overall decent spot 100 yes keep simple buy low cost market etf like voo keep dollar cost averaging aka buying strong weak markets goal need pull money short term challenges ie market lost job need pay bills longer leave compounds snowballs first 10k harder next first 100k harder next first million harder next build good habits dont let lifestyle inflation hit much get better paying job see larger numbers investment accounts good luck sell someday otherwise point like marshmallow question give kids outline delayed gratification would rather 1 marshmallow 3 marshmallows later 30 yr horizon really lucky get 7 real returns 10 nominal 3 inflation 2000 multiply 76x todays dollars 175x nominally like 15224 todays purchasing power wait start investing next year thats 71x 14228 wait two years thats 66x 13297 wait 10 years away sequence returns risk even get steady geometric return youre going 197x money inflation adjusted terms youd need personally save much reach required nest egg difficult think every single dollar matters earlier dollar invested worth future absolutely invest extra money even much live era commission free brokerages make sure emergency fund high yield savings account dont want start buying index funds sell 6 months later loss long emergency fund though absolutely invest amount index funds individual stocks plan basically never sell youre keeping decades theres never better time start today remember time market better timing market yes pick low cost sp 500 fund index fund like voo buy much every month standard advice open roth ira contribute max every year everything else put taxable brokerage account thank much feels doable less scary would love hear thoughts start best throw spy let sit voo spy super similar id recommend voo personally vti whole market biggest 500 companies either fine good enough dont overthink
1lgwjn2,2025-06-21,"Employer stop contributing to my 401k
I've been giving the max allowed, 22%. Their agreement doesn't allow me to withdraw my funds while I'm still employed. Although, I can stop contributing. I also don't have a choice and what they invest in. Of course it's not growing very fast, barely keeping up with inflation.

Should I stop contributing and send that money to my taxable brokerage account? I believe there are some protections built into money inside of 401k versus a brokerage account. But I'm 58 years old and I hope to retire in four or five years and I need growth right now.
”I also don't have a choice and what they invest in.” is this common? I’ve experienced 401k plans at 5 different companies and I never seen where you don’t have multiple choices? They are not always great choices but I always been able to pick between several investment alternatives. If you’re retiring in 4-5 years you should be de-risking not increasing risk. Have you spoken with a financial planner? Reddit isn't a financial planner? It is rare but they do exist.

I am old so some history.  Employers used to do sleazy things with 401k's and pensions.  Like their stock was the investment.   so after lawsuits the government set a standard and made the employers responsible.

1 option has to be a cash/money market investment.  zero risk. and it is the default. 

then there can be risky investments, but they should be varying levels.   so a mix of conservative, aggressive, and bond fund.   so there was a standard 4-5 fund offering that every employer adopted

but it does not have to be a mix of funds.   if it is a no risk investment that has a stable return they are fine.   there seems to be a trend of wealth management companies offering this type of 401k's to employers.  and some companies are going with them.   my guess is that this is smaller companies doing it and they have other financial relationships tied to getting their 401k business. There are so many problems with this post, I don't know where to start. Yeah that doesn’t add up. He has to have investment choices or it’s a breach of fiduciary duty.
Edit- potentially a breach of fiduciary. I could make the argument. Don’t know if I’d win. Source - I’m a lawyer and on a 401k committee. I mean if you’re wrong enough, a real expert can’t help but chime in.  I’ve also never worked for a company that completely barred you from withdrawing during your employment - especially because, as OP pointed out, there is no employer match so those funds are 100% his with no “vesting window” to account for… this has serious fraud vibes.

Why would any employee even choose to participate in this vs managing a private retirement fund on their own? If there is no employer match this 401k program offers nothing but downsides. OP has 30+ years in retirement so OP should be investing.  Too late for his 401k if it's barely better than inflation.

OP needs a fiduciary. I don’t know how long OP has worked here but I’m assuming it defaulted to a target date fund hence the relatively low returns as of late. Its doing its job",85,0.79,102,0,randaladams,investing,['C'],employer stop contributing 401k ive giving max allowed 22 agreement doesnt allow withdraw funds im still employed although stop contributing also dont choice invest course growing fast barely keeping inflation stop contributing send money taxable brokerage account believe protections built money inside 401k versus brokerage account im 58 years old hope retire four five years need growth right also dont choice invest common ive experienced 401k plans 5 different companies never seen dont multiple choices always great choices always able pick several investment alternatives youre retiring 45 years derisking increasing risk spoken financial planner reddit isnt financial planner rare exist old history employers used sleazy things 401ks pensions like stock investment lawsuits government set standard made employers responsible 1 option cashmoney market investment zero risk default risky investments varying levels mix conservative aggressive bond fund standard 45 fund offering every employer adopted mix funds risk investment stable return fine seems trend wealth management companies offering type 401ks employers companies going guess smaller companies financial relationships tied getting 401k business many problems post dont know start yeah doesnt add investment choices breach fiduciary duty edit potentially breach fiduciary could make argument dont know id win source im lawyer 401k committee mean youre wrong enough real expert cant help chime ive also never worked company completely barred withdrawing employment especially op pointed employer match funds 100 vesting window account serious fraud vibes would employee even choose participate vs managing private retirement fund employer match 401k program offers nothing downsides op 30 years retirement op investing late 401k barely better inflation op needs fiduciary dont know long op worked im assuming defaulted target date fund hence relatively low returns late job
